"498","在一次同事的生日聚会上，苏珊为大家准备了一个大蛋糕。大家围在蛋糕旁，拍照留念。然而，细心的同事发现蛋糕上的拼写错误，他把这个问题发到了公司的内部论坛上。苏珊看到帖子后，并没有直接回应错误，而是问了一句：“蛋糕上的拼写错误是你在这个帖子中唯一看到的问题吗？”
问题:
在此情况下，苏珊有什么感觉?","困惑","讽刺","生气","伤心","尴尬","无所谓","B","Modes of Emotional Expression","Indirect Expression"
"397","在一次深夜的聚会中，李明和大家分享了他最近的一个感悟：“我发现我也能理解那种感觉，我也同样害怕面对自己。”随后，他笑了笑，转身去为大家倒酒，似乎想用这个动作来掩盖些什么。
问题:
在此情况下，李明有什么感觉?","害羞","恐惧","自信","无奈","愤怒","困惑","B","Modes of Emotional Expression","Indirect Expression"
"449","在一次学术研讨会上，李明对自己的研究报告能否被接受感到忐忑不安。当他听到评审员说出一句话时，他瞬间愣住了，因为他以为评审员会转述或者修改他的原话。但紧接着，他意识到评审员一字不差地引用了他的原话，这时他的心情发生了转变。
问题:
在此情况下，李明有什么感觉?","惊讶","失望","开心","焦虑","疑惑","感激","C","Modes of Emotional Expression","Direct Expression"
"748","在一次社区会议上，杰克对新建公园的提案表达了自己的担忧，觉得公园可能会带来噪音和安全隐患。邻居回应说：“不明白你为什么这么自私，但随便吧。” 杰克没有直接回应，只是礼貌地笑了笑，并默默地收拾好自己的资料。
问题:
在此情况下，杰克有什么感觉?","愤怒","尴尬","困惑","悲伤","自在","无所谓","B","Modes of Emotional Expression","Indirect Expression"
"599","在一个重要的会议上，李明提出了自己团队的创意方案，却被领导一句轻描淡写的评价‘还有提升空间’给驳回。散会后，一位同事走过来，轻轻拍了拍李明的肩膀，什么也没说。
问题:
在此情况下，李明有什么感觉?","自卑","愤怒","尴尬","平静","感激","困惑","C","Modes of Emotional Expression","Indirect Expression"
"62","艾米在与同事杰克的竞争中失败，失去了晋升的机会。她坐在办公室里，对自己说：“我现在感觉非常小气。”然而，当杰克过来安慰她时，她微笑着恭喜了他。
问题:
在此情况下，艾米有什么感觉?","小气","失望","悲伤","尴尬","愤怒","释然","F","Modes of Emotional Expression","Direct Expression"
"511","在一次求职面试中，面试官对求职者说：“我们很遗憾地告诉你，这个职位没有安排笔试环节。”求职者回应道：“我明白了，这就是为什么有点遗憾他们没有安排笔试。”
问题:
在此情况下，求职者有什么感觉?","遗憾","困惑","安心","不满","焦虑","释然","C","Modes of Emotional Expression","Indirect Expression"
"583","小杰正在家中客厅和父亲一起看球赛，他支持的队伍即将输掉比赛。这时，他突然看到父亲手机上的一条短信，内容显示父亲居然买彩票中了大奖。小杰忍不住惊呼出声，打破了房间的沉默。
问题:
在此情况下，小杰有什么感觉?","惊讶","兴奋","恐惧","悲伤","愤怒","困惑","A","Modes of Emotional Expression","Direct Expression"
"76","艾米丽从东海岸搬来，那天她与朋友开车出游，突然下起了冰雹。虽然她以前从未亲眼见过冰雹，但那天她和朋友因为是否继续开车而发生了激烈的争执。事后，她却对朋友说了一声‘谢谢！’
问题:
在此情况下，艾米丽有什么感觉?","感激","生气","困惑","紧张","伤心","愉快","A","Modes of Emotional Expression","Indirect Expression"
"64","在一个网络论坛上，小明误入了他不常去的子论坛，他发了一个他认为合适的帖子。很快，有人回复了他的帖子，只说了一句‘你进错子论坛了’。小明没有直接回应，而是默默地浏览起其他用户的帖子。
问题:
在此情况下，小明有什么感觉?","困惑","尴尬","愤怒","无所谓","好奇","焦虑","B","Modes of Emotional Expression","Indirect Expression"
